company,trigger,why_now,role_to_contact,outreach_angle,score,source_url
Almetra (formerly Deltia),"€16.3M Series A led by blisce/, with NAP, Merantix Capital, Robert Bosch Venture Capital (Tech.eu & EU-Startups, as of 25 Jun 2026)","Two-source corroborated Series A explicitly earmarked for product development, US expansion and platform build-out — a textbook moment for growth, hiring and go-to-market services. Berlin-based manufacturing intelligence with Bosch/Siemens Energy ties means real budget.",VP Marketing / Head of Growth (or COO for US expansion),Reference their US market entry: 'You just raised €16.3M to cross the Atlantic — here's how we'd stand up your US demand-gen engine before the first sales hires land.',88,https://tech.eu/2026/06/25/almetra-secures-eur163m-series-a-to-drive-smarter-manufacturing/
Compri,"€3.2M seed led by Picus Capital (Tech.eu, as of 24 Jun 2026)","Milan-based AI procurement SaaS just closed seed capital and is at the team-building stage — prime for RevOps, growth marketing and recruiting partners. Fresh signal, on-vertical B2B SaaS.",Founder/CEO or Head of Growth,'Picus-backed seed means you're about to hire your first GTM team — want a RevOps stack blueprint that won't need rebuilding at Series A?',82,https://tech.eu/2026/06/24/compri-secures-eur32m-to-build-ai-powered-procurement-teams/
Kalipso,"$3.2M funding round (Tech.eu, as of 25 Jun 2026)",Barcelona RegTech SaaS just raised — compliance platforms scaling out of seed need content/PR and demand-gen to win enterprise trust. Fresh and on-vertical.,CEO or Head of Marketing,'Lawyers+engineers built the product — but enterprise buyers need trust signals. Let's build the case-study and PR engine that turns your raise into pipeline.',80,https://tech.eu/2026/06/25/kalipso-raises-32m-to-scale-regulatory-compliance-platform/
HR Duo,"€1.6M led by Puma Growth Partners, with Enterprise Ireland (EU-Startups, as of 25 Jun 2026)",Irish HRTech SaaS raised specifically to grow its UK sales team and strengthen SaaS infrastructure — explicit hiring and dev/RevOps demand named in the announcement.,Head of Sales / Head of Revenue,"'You said the raise is for building the UK sales team — want a recruiting + RevOps onboarding playbook so your new reps ramp in weeks, not quarters?'",80,https://www.eu-startups.com/2026/06/amid-a-e500-700-million-sme-hrtech-opportunity-irelands-hr-duo-secures-e1-6-million-for-growth/
SE3 Labs,"Emerged from stealth backed by Lakestar, Seedcamp and EWOR (Tech.eu, as of 26 Jun 2026)","Spatial AI deeptech just unveiled with top-tier backers — stealth exit means new brand, website, positioning and first GTM hires all in play right now.",Founder/CEO or Head of Marketing,'Just out of stealth with Lakestar+Seedcamp behind you — first impressions matter. Want a launch-week positioning and PR sprint to capture the attention window?',78,https://tech.eu/2026/06/26/backed-by-lakestar-seedcamp-and-ewor-se3-unveils-spatial-ai-platform-for-autonomous-systems/
Serpier,"€1.4M from True Collective and EIFO (Tech.eu, as of 25 Jun 2026)","Danish martech SaaS for e-commerce visibility just raised — they sell marketing tech but still need their own growth, design and dev capacity to scale. Adjacent peers make natural partners too.",Founder/CEO or Head of Product,'You help retailers get found — we can help you get your own platform to scale-ready before your next raise. Spare 15 min?',76,https://tech.eu/2026/06/25/serpier-raises-eur14m-to-help-online-retailers-improve-digital-visibility/
XCures,"$46M Series B led by Innovius Capital (Crunchbase, as of 24 Jun 2026)","AI-for-medical-records SaaS just closed a $46M Series B — top of our vertical range, with budget to scale GTM, RevOps and recruiting fast.",VP Marketing / Head of Revenue,'A $46M Series B means aggressive scaling targets — let's pressure-test your RevOps and demand engine before the board's first review.',75,https://news.crunchbase.com/venture/xcures-lands-seriesb-medical-records-ai/
Fika Jobs,"$4M round for video-first AI hiring platform (TechCrunch, as of 23 Jun 2026)","HR-tech SaaS just raised $4M to build out a video-first hiring product with AI agents — at this stage they need growth marketing, design and engineering scale.",Founder/CEO or Head of Growth,'You're disrupting interviews with AI agents — let's make sure your own demand-gen funnel converts as well as your product does. Quick ideas inside.',74,https://news.google.com/rss/articles/CBMiygFBVV95cUxPZkxIX1ZranREV3JIbmlXd2JuUnBBSzVSWUl0NWpjSFNON1hMYmtFWThlWER4V0hiWWVHQ21jZnJDYjJlWFl6c0hZdWJ4VHEzb1JTMjZTNUY2WmZzOTRfZnV4THRrRm9ObEtZSi1iaVVHMHYxUUxpcG5yUmtuZ3JMLXJxSllTWG1EX1NWRDdHMkdVTzBnTUhXT1NFaWJNY1lkUlNhWFRfMVZjNFB0SHRPak9XLXRPZWJpUWxic1R2a1ZNQ0pOVXdzM0xB?oc=5
Kyrok,"€3.1M pre-seed (FinSMEs / The SaaS News, as of 23 Jun 2026)",Two-source-corroborated €3.1M pre-seed — a sizeable pre-seed for a SaaS startup that will be hiring and building GTM imminently.,Founder/CEO,'A €3.1M pre-seed is a strong runway — want a 90-day GTM foundation plan so you hit Series A metrics with the cash you just raised?',70,https://news.google.com/rss/articles/CBMigAFBVV95cUxPQkFXenpiQnJZdk82dTh4RXlnRHRUdTFINVVFVkpZQlBzdFlkV2lHRVRFci1jVVFBSm01Yjk5Y3paVFNkcFIyRVdSdG9acU5pLU42ZE9GTXpOUjJEV2d1QmZhQmpMRXkzdk0weWkyY3hEajNSNVRubndKN010bXlIOA?oc=5
Wakeline,"€2.1M pre-seed led by TechVision Fonds (Tech.eu, as of 24 Jun 2026)","Düsseldorf deeptech (continuously adaptive AI) at pre-seed — small but fresh, with founders who'll outsource design/dev/brand before building in-house. Early relationship wins compound.",Founder/CEO,'Pre-seed is the cheapest time to nail your brand and developer-facing docs — want a quick teardown of how to position adaptive-AI to skeptical buyers?',68,https://tech.eu/2026/06/24/wakeline-lands-eur21m-to-bring-continuous-learning-to-ai/
AethexAI,"$3M pre-seed for full-stack voice AI infrastructure (afrotech.com, as of 22 Jun 2026)","Voice AI infra startup targeting enterprises in emerging markets just raised pre-seed — needs brand, GTM and dev partners to reach enterprise buyers credibly.",Founder/CEO,'Selling voice-AI infra to enterprises means winning procurement and trust — want an enterprise-ready positioning and content plan to match your $3M ambition?',67,https://news.google.com/rss/articles/CBMilgFBVV95cUxPSFdaY3BCVEs1SjBQbHVlRllXSHFyazlZWUFYbEt0d20wZW9sdkh2X1lhNHA5eDFiZlNnWmxpRGo2ejBYcGg1cG1GSzR2UmVwWDFqVkNlYlJOaVg5cnM3UEIwcU1QVDBIdlU3eGYtS2tDZ2V2ME9DTzF3R0gyNEFZNXlWMWxPcFl6QTRHSU9Ta1kyMndCWkE?oc=5
Cambrian,"$6M seed, a16z CSX-backed, blockchain data oracle network (The Block, as of 24 Jun 2026)","a16z-backed seed for B2B blockchain infra — strong investor signal, building stage, needs dev-rel, content and recruiting partners.",Founder/CEO or Head of DevRel,'a16z CSX seed gets you attention — want a developer-relations and content plan to convert that buzz into integrations?',66,https://news.google.com/rss/articles/CBMipAFBVV95cUxOR2hhc0ZQN1FBZEw4bTNiMkpVc1kxa2J0NG9yNFZHUEtWT1NwMzdBUUZ6UUNaOHZVVy1Ub3NqQkg4cWExNXpYamVZZXEyMTBCdmRlWTFYMWZhOTJIRnI2dWFKUkdvWjJNdFpjUG5ISWJLc0k1TnpfVjBIb2RCbzYxWUdLdFNUc1NyQnRrN0ZKVGVFbTNsR2JBYnIwTlEtSFF3S3BITQ?oc=5
Acodyne,"€2.5M pre-seed for autonomous cargo drones (Resilience Media, as of 25 Jun 2026)","Copenhagen deeptech just raised a sizeable pre-seed — early hardware/SaaS hybrid that will need branding, recruiting and engineering support to scale.",Founder/CEO,'Cargo drones live or die on regulatory trust and a sharp narrative — want help building the story investors and customers buy into post-pre-seed?',64,https://news.google.com/rss/articles/CBMivwFBVV95cUxQenJXSzVZOFJNcW44b2gtakRuWWNvaFY4bWtaQmdEWEVFSlJkS1hwbGdaRTg5ODhwSTdTMW5nVmxEdGRmZXFrSW5CNjRkTERJZF9QcDY5TlNyNFpsSFVrM1B4dFdXOUNhbHRGYjNYNVNVN0czOHZISWpORURsOU05Y1JyWWN6R0ZDeGp4MVNLcC1WM05hTEp1aU1pcG5XNFRhS05xLVY0Tm5tRVdEZU1wN2VhZS1teVA4WGlTTHliWQ?oc=5
LiveKid,"Acquired Aldea to expand into Latin America (Tech.eu, as of 24 Jun 2026)","Preschool-management SaaS expanding via acquisition into Mexico/Colombia/Chile — M&A integration and new-market GTM means localization, RevOps and marketing demand.",Head of Growth / COO,'Acquiring Aldea is step one — integrating teams and localizing GTM for LatAm is the hard part. Want a 60-day integration and market-entry plan?',62,https://tech.eu/2026/06/24/livekid-acquires-aldea-to-expand-in-latin-america/
Wayout International,"€2.42M Series A extension (Tech.eu, as of 25 Jun 2026)",Swedish climatetech scaling decentralised water infrastructure — Series A extension means active scaling and likely marketing/recruiting needs. Borderline on-vertical (hardware-heavy) but a SaaS/platform play.,Head of Growth / COO,'A Series A extension to scale deployment is the moment to professionalise your B2B marketing — want a plan to turn pilots into a repeatable pipeline?',60,https://tech.eu/2026/06/25/wayout-raises-eur242m-to-scale-decentralised-drinking-water-infrastructure-platform/
AppsFlyer,"Reportedly $1B Series E at $2.7B valuation, eyeing IPO (Crunchbase, as of 22 Jun 2026)","(unverified) Late-stage marketing analytics raise (above Series B target ceiling but adjacent) — IPO-prep means demand for PR, fractional CFO/IR and RevOps. Treat as edge-of-vertical.",CFO / Head of IR,'IPO chatter means your finance and comms functions are about to be under a microscope — want fractional IPO-readiness support to plug the gaps?',58,https://news.crunchbase.com/venture/marketing-digital-ad-tracker-appsflyer-lands-1b/
Sovra,"$2M pre-seed, stablecoin-powered fintech (EnterpriseAM, as of 22 Jun 2026)","(unverified) New fintech just raised pre-seed — fintech compliance and brand needs are acute, and early-stage means outsourced services. Single thin source.",Founder/CEO,'Stablecoin fintech at pre-seed needs airtight compliance comms from day one — want a quick audit of how your messaging reads to regulators and partners?',56,https://news.google.com/rss/articles/CBMitgFBVV95cUxPVHprYUJiM2FZT1h6ekVaNDNqMVRoZXg1SG5LWmJBTlJXbHk2bGllS05ZUlJWQWRPVUhOaGNYZ19CTm55S1oxeXNFV2tNR1U5Y2NYMWNyRkxtb3QwR2tiSzEyZ210bVNXQzJTQ1JPVDZHWElfOWkxbTlYTElZc0hma29rczFFV1VzdlJIaDZYZXpsTHhaSFhYVEdXY3FuWThyZ2swWm9nUEx3YmRna2piM3Yzc0pyUQ?oc=5
Lytmus AI,"₹5 crore pre-seed led by Boundless Ventures (Business Standard, as of 28 Jun 2026)",(unverified) Fresh AI pre-seed in India — early stage SaaS that will outsource growth and dev work. Single source.,Founder/CEO,'Just closed your pre-seed with Boundless — want a lean GTM kit so your first marketing rupee works twice as hard?',54,https://news.google.com/rss/articles/CBMi2gFBVV95cUxOM0lpamttQlI0bGNzcjdKVVpNMFZiV0VGU2Nudl9nelFGYnp2N2lzYW5KdEpnZk5tQVFKUlBFbDMxWmtHZUhJOUszbktySzRNUlJYTXVwbTdzNl81RnkzSjNrek56eTFGd0NYUHdyUmVBUUlheWVuaGVsckl1eW5UUzJZd3VQZHE2WDVFc2hDX05nLTdxVE1lWHNUbXZpQVl5b2xJQ2llLUJSTk5xV29XbjJ3QmlPd1N1UC0yU0hHWTFmTTF3U25oa2l4bVY4SVlNVVdNYlBhZUZIUdIB3wFBVV95cUxNRDVRYlJyTGVYcTBxR3h2VklCWE9naWkwZXZJN051ZVc0Vm9oM0NRWW9ZRDg1UW1vX0NoMjN1akljYk9GVWRweUpNQWhheVRfNTlZeXRYLW45Z1lrU1VEZGxncEVERzFRaDdCdW4zMGJHN05kbzRYLU9TajFXdkN0WW5lVEJGeUlaTFpPMWxScnJPb0ROWGdXRktHRXdVNl9sTU1zUWdJdjY4emxQTmRZQ25wb0VyMVpUVlNWekhnZWo3eHcyMHd4UzhlOGptdW44YmE0Y2VUcEs2cU81Z0VR?oc=5
ARX Industries (ARX Robotics + Roboneers JV),"New JV formed to industrialise unmanned ground vehicle production (Tech.eu, as of 25 Jun 2026)","A newly formed joint venture / expansion event — new entity means new brand, hiring and ops setup. Defence-hardware focus lowers SaaS fit but it's a genuine expansion trigger.",COO / Head of Operations,"'A brand-new JV needs a brand, careers page and ops backbone fast — want a launch sprint to get ARX Industries market-ready in weeks?'",54,https://tech.eu/2026/06/25/arx-robotics-and-roboneers-form-arx-industries-to-scale-unmanned-ground-vehicle-production/
Sherlocks AI,"Rs 7.5 crore pre-seed led by SenseAI Ventures (Indian Startup Times, as of 23 Jun 2026)","(unverified) AI pre-seed in India — building stage, candidate for outsourced growth/design/dev. Single thin source.",Founder/CEO,'Pre-seed AI startups win or lose on early positioning — want a quick teardown of how to make your product story land with B2B buyers?',52,https://news.google.com/rss/articles/CBMivgFBVV95cUxNc2xwLTFxd1BhT0VUSWw0aFg5U1l4Zmp5VllIVmpRc19aVjBlMHRUTGJGYTVjelEwUmd1ZHVGcmRBN1pBaE9GUW14cHpjQmNPZ3Nlenp6emxBeDFYVVVPeTBBR0JwdWNhWkY5c1pKRWVpcGFZR3lOQVJMN3U5TGlmVEE4VTlaYUxWUXY3bmZWZ3lqTjNmX1B6bGFUTjBFbHJJVUF2bG5tUFJOV3RxdzJQY1BtcjFVNWV0VmdmSk13?oc=5
Lumenai,"Pre-seed round (The SaaS News, as of 24 Jun 2026)","(unverified) SaaS pre-seed with no amount disclosed — on-vertical and fresh, worth a light-touch early outreach. Single thin source, amount unknown.",Founder/CEO,'Congrats on the pre-seed — want a no-strings GTM foundation checklist tailored to early SaaS to make sure month one isn't wasted?',50,https://news.google.com/rss/articles/CBMirwFBVV95cUxOdzlQVnRzUjBaVEh6RDVNVmJPTEtUN2FVQUJ5S2p1bUt3TzhUblpaWjJLQjBpWGw4OFpBTnFwb3pZRmdXU293Rkp1Z0RITk9LS2FmbEFpckJVd0ExNEVXQmNTcW5kYTY1ZFdqdVl3M1UxcHRhc1FQXzNBbm15TVBNUnU1aFE1Sm5Ydjl5RURZd2ktcmpnbzZtRF96bVJJak0tVEt5aWgtSWttVzV6bWdJ?oc=5
Point2 Technology Inc.,"SEC Form D filed (EDGAR, as of 26 Jun 2026)",(unverified) Fresh Form D filing indicates a new securities offering/raise; tech company name but amount and round not detailed in the filing summary. Worth confirming before heavy outreach.,Founder/CEO or CFO,"'Saw your new Form D filing — as you put the new capital to work, want a quick read on where outsourced GTM or finance support pays back fastest?'",48,https://www.sec.gov/Archives/edgar/data/1708694/000092963826002376/0000929638-26-002376-index.htm
Intu Diagnostics,"€1.1M strategic bridge round; total funding now €3M+ (EU-Startups, as of 26 Jun 2026)","Leipzig diagnostics platform raised a bridge — proceeds for IP and platform work; smaller/biotech-leaning so lower fit, but a genuine fresh trigger for dev/regulatory/PR services.",Founder/CEO,'Lab-free diagnostics needs a crisp story for partners and regulators — want help sharpening your platform narrative as you put the bridge to work?',46,https://www.eu-startups.com/2026/06/lab-free-testing-moves-closer-to-home-as-germanys-intu-diagnostics-raises-e1-1-million/
Tissium,"€30M equity + up to €30M debt (Tech.eu, as of 24 Jun 2026)","French medtech raised substantial equity+debt — biotech/medical lowers SaaS fit, but a sizeable, fresh raise with scaling and hiring needs for PR and fractional finance.",CFO / Head of Comms,'A €30M equity + €30M debt structure adds finance and IR complexity — want fractional CFO support to keep reporting investor-grade as you scale?',44,https://tech.eu/2026/06/24/tissium-raises-eur30m-in-equity-eur30m-in-debt/
Leyden Labs,"€40M raise; EIC Fund, Invest-NL, Gates Foundation, ClavystBio (EU-Startups, as of 25 Jun 2026)","Dutch biotech raised a large round — off-core for SaaS service sellers but a genuine large funding trigger; relevant for PR, recruiting and fractional finance providers willing to work biotech.",Head of People / Head of Comms,'A €40M raise with the Gates Foundation in the syndicate raises your public profile overnight — want a comms and recruiting plan to match the attention?',42,https://www.eu-startups.com/2026/06/leyden-labs-secures-e40-million-to-develop-intranasal-protection-against-influenza-and-coronaviruses/
